{
  "$schema": "./comparison-workload-v5.schema.json",
  "schema_version": "bp-comparison-workload-v3",
  "manifest_id": "bp-perf-v5-decision-1",
  "decision_contract_version": "bp-perf-v5-decision-1",
  "supersedes": "bp-perf-v4-decision-1",
  "seed": 20260825,
  "source_manifest": {
    "id": "bp-perf-v4-decision-1",
    "file": "./comparison-workload-v4.materialized.json",
    "artifact_sha256": "4a826bd3c19f3c7693128961f43064e5b7414e799a0f791b7f3381ed59e897b1",
    "byte_sha256": "8828be7c4c7c05a19007bd315c4fc1844a93278c967d49614387c2ae6cfeff52"
  },
  "journey_extensions": [
    {
      "journey_id": "nasa-long-document-v1",
      "append_command_ids": ["viewer:dynamic-fidelity-scroll"]
    },
    {
      "journey_id": "dense-mixed-editing-v1",
      "append_command_ids": [
        "annotation:native-property-edit-undo",
        "annotation:native-snap-transform-120hz"
      ]
    }
  ],
  "additional_journeys": [
    {
      "id": "multi-document-session-v1",
      "fixture_ids": [
        "bp-single-page-v1",
        "nasa-apollo-summary-526-v1",
        "bp-engineering-sheet-v1",
        "bp-annotation-density-v1"
      ],
      "command_ids": [
        "session:open-four-fixtures",
        "session:switch-four-fixtures",
        "session:edit-dense-rectangle",
        "session:close-three-and-recover"
      ]
    }
  ],
  "additional_commands": [
    {
      "id": "viewer:dynamic-fidelity-scroll",
      "operation": "viewer.dynamic-fidelity-scroll-path",
      "fixture_id": "nasa-apollo-summary-526-v1",
      "layout": "continuous",
      "input_lane": "native-replay",
      "input_rate_hz": 120,
      "duration_ms": 32000,
      "expected_trajectory_sample_count": 3841,
      "presentation": {
        "zoom_mode": "fixed-percent",
        "zoom_percent": 100,
        "required_x_device_pixels_per_pdf_point": 1,
        "required_y_device_pixels_per_pdf_point": 1,
        "pixels_per_point_tolerance": 0.01,
        "paired_candidate_scale_tolerance": 0.01,
        "client_device_scale": 1,
        "screenshot_source": "presented-client-drawable",
        "page_bounds_source": "painted-page-bounds",
        "stability_receipt": "painted-before-capture-after",
        "candidate_resampling": "forbidden",
        "reference_resampling": "downsample-only-lanczos3"
      },
      "path": {
        "forward_duration_ms": 20000,
        "forward_motion_duration_ms": 19250,
        "forward_viewport_heights": 50,
        "pause_duration_ms": 2000,
        "reverse_duration_ms": 10000,
        "start_page": 1,
        "finish_page": 1,
        "checkpoint_hold_ms": 250,
        "checkpoint_hold_count": 3,
        "checkpoint_hold_interval_count_each": 30,
        "checkpoint_hold_sample_count_each": 31
      },
      "observer": {
        "rate_hz": 60,
        "expected_sample_count": 1921,
        "clock": "monotonic-independent-fixed-cadence"
      },
      "registered_crops": [
        {
          "crop_id": "nasa-scroll-start-page-1-header",
          "fixture_id": "nasa-apollo-summary-526-v1",
          "page_number": 1,
          "pdf_rect": { "x": 36, "y": 612, "width": 538, "height": 126 },
          "checkpoint": {
            "path_fraction": 0,
            "selection": "nearest-full-crop-visibility",
            "hold_index": 0,
            "hold_ms": 250,
            "zero_input_interval_count": 30,
            "zero_input_sample_count": 31
          },
          "reference_raster": {
            "source": "locked-fixture-pdf",
            "dpi": 144,
            "comparison_dpi": 144,
            "color_space": "srgb",
            "comparison": "bp-cross-engine-binary-scan-fidelity-v2",
            "source_scan_dpi": 300,
            "maximum_phase_offset_px": 1,
            "gaussian_sigma_px": 2,
            "gaussian_radius_px": 6,
            "dark_luma_max": 192,
            "dark_match_radius_px": 1,
            "minimum_filtered_ssim": 0.97,
            "minimum_dark_precision": 0.99,
            "minimum_dark_recall": 0.99,
            "minimum_dark_f1": 0.99,
            "candidate_resampling": "none",
            "reference_resampling": "downsample-only-lanczos3",
            "reference_crop_sha256": "9618896b1558e6e92b1b0d10fec4f1480bd74b7e36d749dde07505eabfad8b5a"
          },
          "registration_sha256": "dd76c737bf0dcd52448505eaf0a176c548259fc1b5d87e422994ab4cfdc15d9e"
        },
        {
          "crop_id": "nasa-scroll-middle-page-15-body",
          "fixture_id": "nasa-apollo-summary-526-v1",
          "page_number": 15,
          "pdf_rect": { "x": 55, "y": 252, "width": 500, "height": 288 },
          "checkpoint": {
            "path_fraction": 0.3125,
            "phase": "forward",
            "selection": "nearest-full-crop-visibility",
            "hold_index": 1,
            "hold_ms": 250,
            "zero_input_interval_count": 30,
            "zero_input_sample_count": 31
          },
          "reference_raster": {
            "source": "locked-fixture-pdf",
            "dpi": 144,
            "comparison_dpi": 144,
            "color_space": "srgb",
            "comparison": "bp-cross-engine-binary-scan-fidelity-v2",
            "source_scan_dpi": 300,
            "maximum_phase_offset_px": 1,
            "gaussian_sigma_px": 2,
            "gaussian_radius_px": 6,
            "dark_luma_max": 192,
            "dark_match_radius_px": 1,
            "minimum_filtered_ssim": 0.97,
            "minimum_dark_precision": 0.99,
            "minimum_dark_recall": 0.99,
            "minimum_dark_f1": 0.99,
            "candidate_resampling": "none",
            "reference_resampling": "downsample-only-lanczos3",
            "reference_crop_sha256": "d0145b0e6e2240098477f7b029d3d52dc912e1633a7cf7dd338b35c50c465a03"
          },
          "registration_sha256": "93148387a5f5ee13a5fd84c5734032046ae267f0e326c6b341b08e919ac2d302"
        },
        {
          "crop_id": "nasa-scroll-forward-apex-page-29-footer",
          "fixture_id": "nasa-apollo-summary-526-v1",
          "page_number": 29,
          "pdf_rect": { "x": 55, "y": 54, "width": 500, "height": 126 },
          "checkpoint": {
            "path_fraction": 0.625,
            "phase": "forward-apex",
            "selection": "nearest-full-crop-visibility",
            "hold_index": 2,
            "hold_ms": 250,
            "zero_input_interval_count": 30,
            "zero_input_sample_count": 31
          },
          "reference_raster": {
            "source": "locked-fixture-pdf",
            "dpi": 144,
            "comparison_dpi": 144,
            "color_space": "srgb",
            "comparison": "bp-cross-engine-binary-scan-fidelity-v2",
            "source_scan_dpi": 300,
            "maximum_phase_offset_px": 1,
            "gaussian_sigma_px": 2,
            "gaussian_radius_px": 6,
            "dark_luma_max": 192,
            "dark_match_radius_px": 1,
            "minimum_filtered_ssim": 0.97,
            "minimum_dark_precision": 0.99,
            "minimum_dark_recall": 0.99,
            "minimum_dark_f1": 0.99,
            "candidate_resampling": "none",
            "reference_resampling": "downsample-only-lanczos3",
            "reference_crop_sha256": "c72c0763c9522e475f205ac7b570b8e0cbee1071497bd163aa2c1ae51f099c77"
          },
          "registration_sha256": "fd170a635e058da4932abe35aa870abfb955955e4be17bb92a98e0033b143963"
        }
      ],
      "required_sample_fields": [
        "visible_page_ready_fraction",
        "visible_raster_ready_area_fraction",
        "visible_raster_pixel_density"
      ],
      "expected_milestones": [
        "timestamped-native-input-complete",
        "fixed-cadence-fidelity-samples-exact",
        "presented-screenshot-crops-three-matched",
        "presented-scale-comparability-proven",
        "checkpoint-holds-stable",
        "visible-page-ready-fraction-recorded",
        "visible-raster-ready-area-fraction-recorded",
        "visible-raster-pixel-density-recorded",
        "virtual-page-window-bounded",
        "finish-page-current"
      ]
    },
    {
      "id": "annotation:native-property-edit-undo",
      "operation": "annotation.property-edit-undo-native",
      "fixture_id": "bp-annotation-density-v1",
      "input_lane": "native-replay",
      "setup": {
        "annotation_id": "comparison:rectangle:property-native:1",
        "page_role": "empty-interaction-page",
        "rectangle": { "x1": 72, "y1": 144, "x2": 252, "y2": 360 },
        "stroke_width_points": 1.5
      },
      "property_edit": {
        "property": "stroke_width_points",
        "from": 1.5,
        "to": 4,
        "native_action_sequence": [
          "focus-properties-trigger",
          "open-properties",
          "focus-stroke-width",
          "select-4pt",
          "commit",
          "shortcut-undo"
        ]
      },
      "candidate_policy": {
        "effective_history_revision_delta": 1,
        "application_undo_count": 1,
        "canonical_state_restored": true
      },
      "electron_baseline_policy": {
        "allowed_known_defect_id": "electron-numeric-property-input-blur-duplicate-history-v1",
        "effective_history_revision_delta": 2,
        "application_undo_count": 1,
        "final_stroke_width_points": 4
      },
      "expected_milestones": [
        "trusted-native-input-complete",
        "property-user-gesture-complete",
        "property-state-current-before-undo",
        "native-property-presentation-acknowledged",
        "application-undo-applied-once",
        "implementation-history-outcome-recorded",
        "thumbnail-current"
      ]
    },
    {
      "id": "annotation:native-snap-transform-120hz",
      "operation": "annotation.snap-transform-native",
      "fixture_id": "bp-annotation-density-v1",
      "input_lane": "native-replay",
      "rate_hz": 120,
      "duration_ms": 3000,
      "expected_sample_count": 361,
      "setup": {
        "annotation_id": "comparison:rectangle:snap-native:1",